Unnamed: 0,title,score,id,subreddit,url,num_comments,body,created,cleaned_text,tokens,disambiguated_sense,sarcasm
410,"Is there a ""Mount Rushmore"" of loss porn?",20,1awnavf,wallstreetbets,https://www.reddit.com/r/wallstreetbets/comments/1awnavf/is_there_a_mount_rushmore_of_loss_porn/,25,I've got some good losses saved on here... but I need *more*. I want the greatest. I'm so close I just need to know I've seen the best before I finish. ,21/2/2024,got good losses saved need want greatest close need know seen best finish,"['got', 'good', 'losses', 'saved', 'need', 'want', 'greatest', 'close', 'need', 'know', 'seen', 'best', 'finish']",a supply of something available for future use,Potential sarcasm
3213,$EQ Equillium head-spinning day,4,1arp0ol,pennystocks,https://www.reddit.com/r/pennystocks/comments/1arp0ol/eq_equillium_headspinning_day/,16,"Equillium dropped 20 percent today. No news, nada. Hung around 18 percent a bit. But decided, nope.  Today we need to eat some greens.  And now, 15 minutes into PH 6 percent up!  

I was wondering, anybody can explain this?  Does anybody have insight trading actions? 

I feel someone tried to shake the tree.  

[https://www.reddit.com/r/pennystocks/comments/1appfhz/eq\_equillium\_steady\_rise\_founders\_institutions/](https://www.reddit.com/r/pennystocks/comments/1appfhz/eq_equillium_steady_rise_founders_institutions/)

&#x200B;

Oh, and that AGEN management should be fired!  What a disgusting way of dealing with shareholders. ",15/2/2024,equillium dropped percent today news nada hung around percent bit decided nope today need eat greens minutes ph percent wondering anybody explain anybody insight trading actions feel someone tried shake tree https https oh agen management fired disgusting way dealing shareholders,"['equillium', 'dropped', 'percent', 'today', 'news', 'nada', 'hung', 'around', 'percent', 'bit', 'decided', 'nope', 'today', 'need', 'eat', 'greens', 'minutes', 'ph', 'percent', 'wondering', 'anybody', 'explain', 'anybody', 'insight', 'trading', 'actions', 'feel', 'someone', 'tried', 'shake', 'tree', 'https', 'https', 'oh', 'agen', 'management', 'fired', 'disgusting', 'way', 'dealing', 'shareholders']",a supply of something available for future use,Potential sarcasm
3894,Ballsy GMBL play…..,2,18maogn,pennystocks,https://i.redd.it/uzmduipv2b7c1.jpeg,20,Hoping for the best with the one folks . 🤞,19/12/2023,hoping best one folks,"['hoping', 'best', 'one', 'folks']",the descendants of one individual,Potential sarcasm
4049,Best Bitcoin or Cryptocurrency Documentaries,1,1azncij,Bitcoin,https://www.reddit.com/r/Bitcoin/comments/1azncij/best_bitcoin_or_cryptocurrency_documentaries/,3,What are the best Bitcoin/Crypto documentaries to watch?,25/2/2024,best documentaries watch,"['best', 'documentaries', 'watch']",a supply of something available for future use,Potential sarcasm
4250,Here's my honest question about BTC security,0,1axotyd,Bitcoin,https://www.reddit.com/r/Bitcoin/comments/1axotyd/heres_my_honest_question_about_btc_security/,34,"What would we do if Bitcoin miners ""unionized"" in a sense and decided to charge outrageous fees to make transactions happen? Or what happens if all the miners decide to stop verifying transactions until they were given a ransom?",23/2/2024,would bitcoin miners unionized sense decided charge outrageous fees make transactions happen happens miners decide stop verifying transactions given ransom,"['would', 'bitcoin', 'miners', 'unionized', 'sense', 'decided', 'charge', 'outrageous', 'fees', 'make', 'transactions', 'happen', 'happens', 'miners', 'decide', 'stop', 'verifying', 'transactions', 'given', 'ransom']",a supply of something available for future use,Potential sarcasm
4489,Question for you guys,0,1avqmii,Bitcoin,https://www.reddit.com/r/Bitcoin/comments/1avqmii/question_for_you_guys/,10,I want to buy some bitcoin a 500 or a 1000 $ and I am wondering what is the best month to buy some before the halving pike?,20/2/2024,want buy bitcoin wondering best month buy halving pike,"['want', 'buy', 'bitcoin', 'wondering', 'best', 'month', 'buy', 'halving', 'pike']",a supply of something available for future use,Potential sarcasm
4584,Ladies and Gentlemen I would like to announce our new Executive Producer.,4,1aupowh,Bitcoin,https://www.reddit.com/r/Bitcoin/comments/1aupowh/ladies_and_gentlemen_i_would_like_to_announce_our/,2,"I have been a YUGE fan of Wasabi Wallet from day 0, so I can't tell you how happy I am that they are an Executive cProducer for my movie, Satoshis Don't Exist.

Considering that the movie is about Fungibility & Privacy, I don't think I have to explain why this works perfectly :D

Here are some promotional posters I made to announce the even, yes I took the pictures.

[1](https://preview.redd.it/4dm9h3kn6kjc1.jpg?width=2160&format=pjpg&auto=webp&s=d58dc9f002741ff5b872fc90c0bbe32fa2841f55)

&#x200B;

[2](https://preview.redd.it/gx3lkp9q6kjc1.jpg?width=2160&format=pjpg&auto=webp&s=9199697d129d99ef26ced535f2efe6fc44988775)

More info about the movie:

* [https://twitter.com/SatsDontExist](https://twitter.com/SatsDontExist)
* Here are some promotional posters I made to announce the event. Yes I took the pictures.",19/2/2024,yuge fan wasabi wallet day ca tell happy executive cproducer movie satoshis exist considering movie fungibility privacy think explain works perfectly promotional posters made announce even yes took pictures https https info movie https https promotional posters made announce event yes took pictures,"['yuge', 'fan', 'wasabi', 'wallet', 'day', 'ca', 'tell', 'happy', 'executive', 'cproducer', 'movie', 'satoshis', 'exist', 'considering', 'movie', 'fungibility', 'privacy', 'think', 'explain', 'works', 'perfectly', 'promotional', 'posters', 'made', 'announce', 'even', 'yes', 'took', 'pictures', 'https', 'https', 'info', 'movie', 'https', 'https', 'promotional', 'posters', 'made', 'announce', 'event', 'yes', 'took', 'pictures']",a supply of something available for future use,Potential sarcasm
4618,Best way to DCA.,5,1aujeey,Bitcoin,https://www.reddit.com/r/Bitcoin/comments/1aujeey/best_way_to_dca/,19,"I have about $500 a month for BTC.

What is the best way to buy?  
500 monthly  
250 fortnightly  
125 weekly",19/2/2024,month btc best way buy monthly fortnightly weekly,"['month', 'btc', 'best', 'way', 'buy', 'monthly', 'fortnightly', 'weekly']",a supply of something available for future use,Potential sarcasm
4693,How can I convert my  Pension into Bitcoin? (Europe) ,15,1atq5fk,Bitcoin,https://www.reddit.com/r/Bitcoin/comments/1atq5fk/how_can_i_convert_my_pension_into_bitcoin_europe/,7,"I have a pension in Ireland with Mercer. I called saying is there any way I can get bitcoin exposure, they had no idea. I can transfer my pension to another provider though. Does anyone know what the best way for me would be to this? How can I find a list of pensions that enable me to utilise a Bitcoin etf for part of 100%?",18/2/2024,pension ireland mercer called saying way get bitcoin exposure idea transfer pension another provider though anyone know best way would find list pensions enable utilise bitcoin etf part,"['pension', 'ireland', 'mercer', 'called', 'saying', 'way', 'get', 'bitcoin', 'exposure', 'idea', 'transfer', 'pension', 'another', 'provider', 'though', 'anyone', 'know', 'best', 'way', 'would', 'find', 'list', 'pensions', 'enable', 'utilise', 'bitcoin', 'etf', 'part']",a plant or stem onto which a graft is made; especially a plant grown specifically to provide the root part of grafted plants,Potential sarcasm
4936,What is your preferred method to buy BTC in the US?,2,1arnorj,Bitcoin,https://www.reddit.com/r/Bitcoin/comments/1arnorj/what_is_your_preferred_method_to_buy_btc_in_the_us/,10,"I have a DCA set through River, but I would like to just make some chunk purchases as well.  What do you consider to be the best method for doing so in the US? I've only bought through Coinbase years ago.",15/2/2024,dca set river would like make chunk purchases well consider best method us bought coinbase years ago,"['dca', 'set', 'river', 'would', 'like', 'make', 'chunk', 'purchases', 'well', 'consider', 'best', 'method', 'us', 'bought', 'coinbase', 'years', 'ago']",a supply of something available for future use,Potential sarcasm
5719,Buy Shiba3000! Shiba2999 was a rug pull but Shiba3000 is the real deal I stg no cap on my mama,3,1ao01xv,Shibainucoin,https://www.reddit.com/r/Shibainucoin/comments/1ao01xv/buy_shiba3000_shiba2999_was_a_rug_pull_but/,7,This subreddit is terrible,11/2/2024,subreddit terrible,"['subreddit', 'terrible']",a supply of something available for future use,Potential sarcasm
7642,Best Stocks To Buy Now: 19 Airline Stocks That Will Make You a Millionaire in (2024),1,19467qz,StockMarketMovers,https://www.reddit.com/r/StockMarketMovers/comments/19467qz/best_stocks_to_buy_now_19_airline_stocks_that/,3,"If you’re looking to invest in the airline industry, you might want to check out the video titled “[Best Stocks To Buy Now: 19 Airline Stocks That Will Make You a Millionaire in (2024)](https://youtu.be/BvX7P4fek88)",11/1/2024,looking invest airline industry might want check video titled best stocks buy airline stocks make millionaire https,"['looking', 'invest', 'airline', 'industry', 'might', 'want', 'check', 'video', 'titled', 'best', 'stocks', 'buy', 'airline', 'stocks', 'make', 'millionaire', 'https']",a supply of something available for future use,Potential sarcasm
8216,"Earnings for the Week of May 23, 2022",29,uul3n7,StockMarketMovers,https://www.reddit.com/r/StockMarketMovers/comments/uul3n7/earnings_for_the_week_of_may_23_2022/,0,"The most anticipated earnings releases scheduled for the week are Nvidia #NVDA, Alibaba #BABA, Best Buy #BBY, XPeng #XPEV, Zoom #ZM, Costco #COST, Macy's #M, AutoZone #AZO, DICK's Sporting Goods #DKS, and Niu Technologies #NIU.  

[http://eps.sh/cal](http://eps.sh/cal) 

[Calendar for the Week](https://preview.redd.it/iuo0fuwlct091.png?width=1920&format=png&auto=webp&s=4d372e92707d43ab6d321c40612d00d4d3f48156)",21/5/2022,anticipated earnings releases scheduled week nvidia nvda alibaba baba best buy bby xpeng xpev zoom zm costco cost macy autozone azo dick sporting goods dks niu technologies niu http http calendar week https,"['anticipated', 'earnings', 'releases', 'scheduled', 'week', 'nvidia', 'nvda', 'alibaba', 'baba', 'best', 'buy', 'bby', 'xpeng', 'xpev', 'zoom', 'zm', 'costco', 'cost', 'macy', 'autozone', 'azo', 'dick', 'sporting', 'goods', 'dks', 'niu', 'technologies', 'niu', 'http', 'http', 'calendar', 'week', 'https']",a supply of something available for future use,Potential sarcasm
8606,SealsQ Enters AI Semiconductor Market 🤑💥🚀,3,1aow6i7,WallStreetbetsELITE,https://www.reddit.com/r/WallStreetbetsELITE/comments/1aow6i7/sealsq_enters_ai_semiconductor_market/,1,"Read this fucking awesome News!! 💪🏼🤑🤑🤑

https://www.globenewswire.com/news-release/2024/02/12/2827185/0/en/SEALSQ-Announces-Groundbreaking-Entry-Into-AI-Chip-Market-With-Advanced-AIoT-Strategy.html",12/2/2024,read fucking awesome news https,"['read', 'fucking', 'awesome', 'news', 'https']",a supply of something available for future use,Potential sarcasm
9282,Twitter space today after market close discussing NREG FITSF MVCO FZRO AITX BLFR and more,22,18bl8aw,WallStreetbetsELITE,https://www.reddit.com/r/WallStreetbetsELITE/comments/18bl8aw/twitter_space_today_after_market_close_discussing/,0,"It starts today at 4PM EST. Anyone can come up and speak too and share their best pick of the week. Also there will be guest speakers on the call including PickleJar ceo, Jeff James, he will speak on the space about what happened with YCRM and the completion of the definitive agreement with NREG

Here is a link to the twitter space call so you can attend https://x.com/stockpicksnyc/status/1732103968656941076?s=45

Anyone can speak and share their pick of the week..bags and runners.",5/12/2023,starts today est anyone come speak share best pick week also guest speakers call including picklejar ceo jeff james speak space happened ycrm completion definitive agreement nreg link twitter space call attend https anyone speak share pick week bags runners,"['starts', 'today', 'est', 'anyone', 'come', 'speak', 'share', 'best', 'pick', 'week', 'also', 'guest', 'speakers', 'call', 'including', 'picklejar', 'ceo', 'jeff', 'james', 'speak', 'space', 'happened', 'ycrm', 'completion', 'definitive', 'agreement', 'nreg', 'link', 'twitter', 'space', 'call', 'attend', 'https', 'anyone', 'speak', 'share', 'pick', 'week', 'bags', 'runners']",a supply of something available for future use,Potential sarcasm
9394,Help needed to find reliable hardware wallet,6,1adpge2,XRP,https://www.reddit.com/r/XRP/comments/1adpge2/help_needed_to_find_reliable_hardware_wallet/,32,"Help needed to find hardware wallet, does anyone know the best uk hardware wallet that doesn't cost the earth to put ya crypto on and off the wallet. must be reliable and if it ever goes down the cyrpto can still be recovered",29/1/2024,help needed find hardware wallet anyone know best uk hardware wallet cost earth put ya crypto wallet must reliable ever goes cyrpto still recovered,"['help', 'needed', 'find', 'hardware', 'wallet', 'anyone', 'know', 'best', 'uk', 'hardware', 'wallet', 'cost', 'earth', 'put', 'ya', 'crypto', 'wallet', 'must', 'reliable', 'ever', 'goes', 'cyrpto', 'still', 'recovered']",put forth and grow sprouts or shoots,Potential sarcasm
9656,What's the best wallet,17,186900w,XRP,https://www.reddit.com/r/XRP/comments/186900w/whats_the_best_wallet/,55,Sup guys was wondering what is the best wallet to store xrp?,28/11/2023,sup guys wondering best wallet store xrp,"['sup', 'guys', 'wondering', 'best', 'wallet', 'store', 'xrp']",a supply of something available for future use,Potential sarcasm
9820,Recommendation for a Hot wallet?,8,17jwqgz,XRP,https://www.reddit.com/r/XRP/comments/17jwqgz/recommendation_for_a_hot_wallet/,20,"I’ve been hearing terrible things about trust wallet. People keep claiming that their coins just disappear or are stolen. 

Side note- it’s incredibly stupid that Coinbase wallet doesn’t support XRP.",30/10/2023,hearing terrible things trust wallet people keep claiming coins disappear stolen side incredibly stupid coinbase wallet support xrp,"['hearing', 'terrible', 'things', 'trust', 'wallet', 'people', 'keep', 'claiming', 'coins', 'disappear', 'stolen', 'side', 'incredibly', 'stupid', 'coinbase', 'wallet', 'support', 'xrp']",amass so as to keep for future use or sale or for a particular occasion or use,Potential sarcasm
10163,Tonight's scary thought,0,15jfhtj,XRP,https://www.reddit.com/r/XRP/comments/15jfhtj/tonights_scary_thought/,22,"I had a waking nightmare and wanted to share.

Had a terrible thought.....what if part of Musk's plan to turn X into an all-in-one app included trying to purchase Ripple and folding it in to handle payments?",6/8/2023,waking nightmare wanted share terrible thought part musk plan turn x app included trying purchase ripple folding handle payments,"['waking', 'nightmare', 'wanted', 'share', 'terrible', 'thought', 'part', 'musk', 'plan', 'turn', 'x', 'app', 'included', 'trying', 'purchase', 'ripple', 'folding', 'handle', 'payments']",the handle of a handgun or the butt end of a rifle or shotgun or part of the support of a machine gun or artillery gun,Potential sarcasm
